{
  "schema_version": "1.0.0",
  "match_id": "m017",
  "languages": [
    "en",
    "es"
  ],
  "cues": [
    {
      "cue_id": "m017-c001",
      "match_id": "m017",
      "moment_id": "m017-mo01",
      "t_show": 30.0,
      "duration": 6.0,
      "layer": "pundit",
      "template": "timeline_item",
      "lang": "en",
      "priority": 0.2,
      "box": {
        "headline": "Corner, Brackenford",
        "body": "Header blocked behind.",
        "evidence": [
          {
            "id": "ev1",
            "claim_type": "stat",
            "value": "Header blocked behind, xG 0.18",
            "source": "m017-e0015",
            "numbers": {
              "xg": 0.18
            }
          }
        ]
      }
    },
    {
      "cue_id": "m017-c002",
      "match_id": "m017",
      "moment_id": "m017-mo03",
      "t_show": 57.9,
      "duration": 3.0,
      "layer": "player",
      "template": "speed_badge",
      "lang": "en",
      "player_id": "ash-09",
      "priority": 0.0,
      "badge": {
        "player_id": "ash-09",
        "speed_kmh": 34.3,
        "season_best": false
      }
    },
    {
      "cue_id": "m017-c003",
      "match_id": "m017",
      "moment_id": "m017-mo03",
      "t_show": 61.0,
      "duration": 12.0,
      "layer": "global",
      "template": "replay",
      "lang": "en",
      "priority": 0.92,
      "camera": {
        "shot": "spidercam_goal",
        "replay": [
          48.0,
          59.6
        ],
        "replay_speed": 0.5,
        "trail": false
      }
    },
    {
      "cue_id": "m017-c004",
      "match_id": "m017",
      "moment_id": "m017-mo03",
      "t_show": 61.0,
      "duration": 12.0,
      "layer": "player",
      "template": "replay",
      "lang": "en",
      "player_id": "ash-09",
      "priority": 0.92,
      "camera": {
        "shot": "spidercam_goal",
        "replay": [
          48.0,
          59.6
        ],
        "replay_speed": 0.5,
        "highlight": "ash-09",
        "trail": true,
        "speedo": 34.3
      }
    },
    {
      "cue_id": "m017-c005",
      "match_id": "m017",
      "moment_id": "m017-mo03",
      "t_show": 61.0,
      "duration": 12.0,
      "layer": "player",
      "template": "replay",
      "lang": "en",
      "player_id": "ash-08",
      "priority": 0.92,
      "camera": {
        "shot": "spidercam_goal",
        "replay": [
          48.0,
          59.6
        ],
        "replay_speed": 0.5,
        "highlight": "ash-08",
        "trail": true,
        "speedo": 28.8
      }
    },
    {
      "cue_id": "m017-c006",
      "match_id": "m017",
      "moment_id": "m017-mo03",
      "t_show": 61.0,
      "duration": 12.0,
      "layer": "player",
      "template": "replay",
      "lang": "en",
      "player_id": "ash-06",
      "priority": 0.92,
      "camera": {
        "shot": "spidercam_goal",
        "replay": [
          48.0,
          59.6
        ],
        "replay_speed": 0.5,
        "highlight": "ash-06",
        "trail": true,
        "speedo": 23.4
      }
    },
    {
      "cue_id": "m017-c007",
      "match_id": "m017",
      "moment_id": "m017-mo03",
      "t_show": 73.0,
      "duration": 8.0,
      "layer": "club",
      "template": "fact_box",
      "lang": "en",
      "team_id": "ash",
      "priority": 0.9,
      "box": {
        "headline": "Derby lead for Ashmere",
        "body": "One up in the Kilnside derby, and the win chance jumps from 44% to 63%.",
        "evidence": [
          {
            "id": "ev5",
            "claim_type": "win_prob",
            "value": "Ashmere win probability 44% to 63%",
            "source": "winprob:m017:59.0",
            "numbers": {
              "before": 0.44,
              "after": 0.63
            }
          }
        ]
      },
      "camera": {
        "shot": "spidercam_goal",
        "replay": [
          48.0,
          59.6
        ],
        "replay_speed": 0.5,
        "trail": true
      }
    },
    {
      "cue_id": "m017-c008",
      "match_id": "m017",
      "moment_id": "m017-mo03",
      "t_show": 73.0,
      "duration": 8.0,
      "layer": "player",
      "template": "fact_box",
      "lang": "en",
      "player_id": "ash-09",
      "priority": 0.92,
      "box": {
        "headline": "Varrow: 34.3 km/h, then 104 km/h",
        "body": "Varrow hit 34.3 km/h onto the through ball and finished at 104 km/h. That's 4 league goals this season.",
        "evidence": [
          {
            "id": "ev2",
            "claim_type": "stat",
            "value": "Varrow reached 34.3 km/h, covering 77.5 m",
            "source": "track:ash-09:48.0-59.6",
            "numbers": {
              "top_speed_kmh": 34.3,
              "distance_m": 77.5
            }
          },
          {
            "id": "ev3",
            "claim_type": "stat",
            "value": "Shot at 104 km/h, xG 0.27",
            "source": "m017-e0026",
            "numbers": {
              "shot_speed_kmh": 104.0,
              "xg": 0.27
            }
          },
          {
            "id": "ev4",
            "claim_type": "season",
            "value": "Varrow now has 4 league goals this season",
            "source": "season:ash-09:goals",
            "numbers": {
              "goals": 4.0
            }
          }
        ],
        "analyst": {
          "event_ids": [
            "m017-e0025",
            "m017-e0026",
            "m017-e0023",
            "m017-e0024",
            "m017-e0020",
            "m017-e0021"
          ],
          "pass_map": [
            [
              37.0,
              31.0,
              49.0,
              39.0
            ],
            [
              56.0,
              37.0,
              80.0,
              29.0
            ]
          ],
          "notes": [
            "Pressure on the passer 0.4 when the through ball was played"
          ]
        }
      }
    },
    {
      "cue_id": "m017-c009",
      "match_id": "m017",
      "moment_id": "m017-mo03",
      "t_show": 73.0,
      "duration": 8.0,
      "layer": "player",
      "template": "fact_box",
      "lang": "en",
      "player_id": "ash-08",
      "priority": 0.92,
      "box": {
        "headline": "Kestley splits the line",
        "body": "A 25.3 m through ball under pressure, rated 0.71 difficulty, put the striker clean through.",
        "evidence": [
          {
            "id": "ev1",
            "claim_type": "stat",
            "value": "25.3 m line-breaking through ball, difficulty 0.71",
            "source": "m017-e0024",
            "numbers": {
              "distance_m": 25.3,
              "difficulty": 0.71
            }
          }
        ],
        "analyst": {
          "event_ids": [
            "m017-e0025",
            "m017-e0026",
            "m017-e0023",
            "m017-e0024",
            "m017-e0020",
            "m017-e0021"
          ],
          "pass_map": [
            [
              37.0,
              31.0,
              49.0,
              39.0
            ],
            [
              56.0,
              37.0,
              80.0,
              29.0
            ]
          ],
          "notes": [
            "Pressure on the passer 0.4 when the through ball was played"
          ]
        }
      }
    },
    {
      "cue_id": "m017-c010",
      "match_id": "m017",
      "moment_id": "m017-mo03",
      "t_show": 73.0,
      "duration": 8.0,
      "layer": "player",
      "template": "fact_box",
      "lang": "en",
      "player_id": "ash-06",
      "priority": 0.92,
      "box": {
        "headline": "Brennick starts it",
        "body": "Took the ball off the centre back, carried it into midfield and found the pass that started the move.",
        "evidence": [],
        "analyst": {
          "event_ids": [
            "m017-e0025",
            "m017-e0026",
            "m017-e0023",
            "m017-e0024",
            "m017-e0020",
            "m017-e0021"
          ],
          "pass_map": [
            [
              37.0,
              31.0,
              49.0,
              39.0
            ],
            [
              56.0,
              37.0,
              80.0,
              29.0
            ]
          ],
          "notes": [
            "Pressure on the passer 0.4 when the through ball was played"
          ]
        }
      }
    },
    {
      "cue_id": "m017-c011",
      "match_id": "m017",
      "moment_id": "m017-mo03",
      "t_show": 73.0,
      "duration": 8.0,
      "layer": "player",
      "template": "fact_box",
      "lang": "es",
      "player_id": "ash-09",
      "priority": 0.92,
      "box": {
        "headline": "Varrow: 34.3 km/h, y luego 104 km/h",
        "body": "Varrow alcanzó 34.3 km/h hacia el pase al hueco y definió a 104 km/h. Ya suma 4 goles de liga esta temporada.",
        "evidence": [
          {
            "id": "ev2",
            "claim_type": "stat",
            "value": "Varrow reached 34.3 km/h, covering 77.5 m",
            "source": "track:ash-09:48.0-59.6",
            "numbers": {
              "top_speed_kmh": 34.3,
              "distance_m": 77.5
            }
          },
          {
            "id": "ev3",
            "claim_type": "stat",
            "value": "Shot at 104 km/h, xG 0.27",
            "source": "m017-e0026",
            "numbers": {
              "shot_speed_kmh": 104.0,
              "xg": 0.27
            }
          },
          {
            "id": "ev4",
            "claim_type": "season",
            "value": "Varrow now has 4 league goals this season",
            "source": "season:ash-09:goals",
            "numbers": {
              "goals": 4.0
            }
          }
        ]
      }
    },
    {
      "cue_id": "m017-c012",
      "match_id": "m017",
      "moment_id": "m017-mo03",
      "t_show": 73.0,
      "duration": 8.0,
      "layer": "pundit",
      "template": "fact_box",
      "lang": "en",
      "priority": 0.85,
      "box": {
        "headline": "One pass, two lines gone",